{"contractVersion":"quote-request-plan/1.0","prospectiveRunId":"run","sportsDate":"2026-07-23","frozenAt":"2026-07-22T12:00:00.000Z","quotePlanHash":"aaaaaaaaaaaaaaaaaaaaaaaaaaaaaaaaaaaaaaaaaaaaaaaaaaaaaaaaaaaaaaaa","requests":[{"id":"q","prospectiveRunId":"run","fixtureAssessmentId":"a","matchDecisionId":"m","sportsDate":"2026-07-23","fixtureIdentityRaw":{"forebetObservationId":"f","statareaRowId":"s","homeTeamRaw":"Home","awayTeamRaw":"Away","competitionRaw":null,"countryRaw":null,"scheduledKickoffRaw":null},"homeTeamRaw":"Home","awayTeamRaw":"Away","competitionRaw":null,"countryRaw":null,"scheduledKickoffRaw":null,"family":"DOUBLE_CHANCE","internalMarketCode":"1X","marketComponents":["1X"],"prePricePriorityScore":70,"prePricePriorityClass":"TRACK","prePriceSelectionStatus":"PROVISIONAL","quoteRequired":true,"bookmaker":"APOSTALA","bookmakerMarketCode":"UNRESOLVED","bookmakerMarketLabel":"UNRESOLVED","availableOdds":null,"priceStatus":"NOT_CAPTURED","marketValueStatus":"UNKNOWN","warnings":[]}]}
